{
    "userId": 123,
    "username": "data_scientist",
    "personalInfo": {
        "email": "test@example.com",
        "height_m": 1.82
    },
    "tags": ["python", "optimization", 101],
    "posts": [
        {"postId": 1, "content": "Hello World!"},
        {"postId": 2, "content": "JSON Schema is great."}
    ]
}